<?xml version="1.0" encoding="UTF-8" standalone="yes"?>
<userData xmlns="http://www.ServerRenting.lt/viko/eif/rstankevicius/serverrenting/api/userDataCheck"
          xmlns:xsi="http://www.w3.org/2001/XMLSchema-instance"
          xsi:schemaLocation="http://www.ServerRenting.lt/viko/eif/rstankevicius/serverrenting/api/userDataCheck userdataToWDSL.xsd">

    <id>1</id>
    <username>Jeff</username>
    <password>ToBBy25</password>
    <userPackage>
        <id>1</id>
        <name>Gold</name>
        <price>169.99</price>
        <dedicatedServers>
            <id>1</id>
            <storageSpace>1</storageSpace>
            <cpu>AMD Ryzen™ 5 PRO 3600</cpu>
            <ram>32 GB DDR4 3400</ram>
            <os>Windows Server</os>
        </dedicatedServers>
        <dedicatedServers>
            <id>2</id>
            <storageSpace>2</storageSpace>
            <cpu>AMD Ryzen™ 9 PRO 3900</cpu>
            <ram>128 GB DDR4 3400</ram>
            <os>Ubuntu</os>
        </dedicatedServers>
        <cloudServers>
            <id>1</id>
            <vCores>2</vCores>
            <storageSpace>80</storageSpace>
            <ram>4 GB DDR4 3400</ram>
        </cloudServers>
    </userPackage>
</userData>
